{
  "domain": "debris-flow-response",
  "version": 2,
  "sample_id": "record-018",
  "as_of": "2026-09-19T23:30:00+08:00",
  "actors": [
    "应急指挥人员",
    "现场搜救队伍",
    "现场签到点",
    "家属联络人员",
    "权威信息发布人员"
  ],
  "facts": [
    "局部强降雨在石家沟隧道附近引发泥石流险情",
    "截至九月十九日深夜，最初五名失联人员中两人已被找到",
    "其余三名失联人员的搜救仍在石家沟隧道附近持续",
    "再降雨可能触发二次灾害，必须能按气象地质警报立即停工撤离"
  ],
  "situation_elements": [
    "灾害边界：实际影响范围（含石家沟隧道口及沟谷），边界变更需留痕",
    "气象地质警报：降雨与次生灾害预警等级，驱动停工撤离决策",
    "家属核验：每名失联人员一条权威身份记录，找到与仍失联分别标记确认状态",
    "搜索网格：覆盖状态（未开始/进行中/已覆盖/需重搜），重搜需登记原因",
    "队伍能力：各搜救队资质与可执行任务类型（绳索、破拆、犬搜、医疗等）",
    "车辆装备：归属、位置与占用状态，被谁占用可查",
    "进出记录：人员车辆经签到点进入危险区的时间、同行人和方向",
    "人员交接：班次交接时现场实有人员与任务的双签确认"
  ],
  "event_log_types": [
    "重复报警：同一失联/险情线索重复报入，合并到既有档案并指向原记录",
    "坐标修正：对已发布坐标的修正必须形成新版本，不得覆盖旧值",
    "再降雨停工：警报触发的停工撤离事件，记录通知与回执情况",
    "网格重搜：已覆盖网格因新线索重新搜索，只追加原因与批准人",
    "轮班：进出与交接双签事件，不改写历史班次记录"
  ],
  "constraints": [
    "名单、搜索区域与对外表述必须同步更新，避免队伍携带过期信息进入石家沟隧道附近危险地带",
    "重复报警、坐标修正、再降雨停工、网格重搜和轮班只能追加事件，不得删除或覆盖",
    "弱网现场可离线领取签名任务并在恢复连接后回传，任务分配与完成以签名为准",
    "家属联络岗位只看必要身份信息，不暴露搜救部署细节",
    "新闻发布只引用已确认状态，不发布未经核验的信息",
    "指挥员打开系统即能看到：已覆盖区域、未确认人员、资源占用方与下一次通报依据"
  ]
}
